{"$id":"https://offdata.local/schemas/pcfa08-final-pre-codex-cross-authority-acceptance.schema.json","$schema":"https://json-schema.org/draft/2020-12/schema","additionalProperties":false,"properties":{"acceptance_id":{"const":"FINAL-PRE-CODEX-CROSS-AUTHORITY-ACCEPTANCE"},"authority_inputs":{"items":{"additionalProperties":false,"properties":{"id":{"type":"string"},"path":{"type":"string"},"role":{"type":"string"},"sha256":{"pattern":"^[0-9a-f]{64}$","type":"string"}},"required":["id","path","role","sha256"],"type":"object"},"minItems":9,"type":"array"},"boundaries":{"type":"object"},"branch_cleanup_plan":{"type":"object"},"canonical_branch":{"const":"main"},"cross_authority_invariants":{"items":{"additionalProperties":false,"properties":{"accepted":{"const":true},"id":{"pattern":"^XAUTH-[0-9]{2}$"},"statement":{"type":"string"}},"required":["id","statement","accepted"],"type":"object"},"maxItems":18,"minItems":18,"type":"array"},"generated_from":{"const":"configs/pcfa08-final-pre-codex-cross-authority-acceptance.yaml"},"launch_target":{"type":"object"},"manual_launch_gates":{"maxItems":8,"minItems":8,"type":"array"},"next_actions_after_integration":{"maxItems":7,"minItems":7,"type":"array"},"repository":{"const":"rayrayxing/offdata-os"},"repository_acceptance":{"type":"object"},"schema_version":{"const":"1.0.0"},"status":{"const":"repository_cross_authority_accepted_manual_launch_gates_pending"},"summary":{"type":"object"},"title":{"type":"string"},"work_package_id":{"const":"PCFA-08"}},"required":["schema_version","work_package_id","acceptance_id","title","status","repository","canonical_branch","generated_from","authority_inputs","cross_authority_invariants","repository_acceptance","manual_launch_gates","branch_cleanup_plan","launch_target","boundaries","next_actions_after_integration","summary"],"title":"offdata PCFA-08 final pre-Codex cross-authority acceptance","type":"object"}
