{"acceptance_id":"FINAL-PRE-CODEX-CROSS-AUTHORITY-ACCEPTANCE","authority_inputs":[{"id":"AGENTS","path":"AGENTS.md","role":"controlling_instruction","sha256":"26a388c60feec633bb2cd8e1d3e339cd121086ac796beb39ae2872dae3f87982"},{"id":"WS6-RELEASE","path":"releases/pre-codex-final-reconciliation-2026-08-06.json","role":"immutable_permanent_release_evidence","sha256":"b8c5f306583f5f52826ea2110e24603e30cfde00215502e9d8ca647b93a67825"},{"id":"PCFA-01","path":"contracts/pcfa01-launch-control-repair.json","role":"launch_semantics_repair","sha256":"5739618e347220b7798d9f5dfa7976bf3beda13deefde5c2ff980ba1a2d4c506"},{"id":"PCFA-03","path":"repository/repository-visibility-and-licence-posture.json","role":"repository_visibility_and_licence_posture","sha256":"b9ad8e1d08d52bf0e598f932e432319e12a336f735627f447f1269ce66e4ece1"},{"id":"PCFA-04","path":"repository/pcfa04-product-scope-implementation-addendum.json","role":"product_scope_addendum","sha256":"4fc34f58149ca5363def1b8e451c12aed8523adc430343cc35301cb2078532ce"},{"id":"PCFA-05","path":"repository/pcfa05-minimum-valuable-consulting-loop.json","role":"minimum_valuable_consulting_loop","sha256":"c69e0d81fc4cf4da8de51a8ff3e997752fcbb65f951cdc8f529d5d00762a2f70"},{"id":"PCFA-06","path":"repository/pcfa06-hermes-bounded-adoption-refresh.json","role":"hermes_bounded_adoption_refresh","sha256":"b5254b0bef3b282557d3c8e3241d8ac5385811fc8c5729c568e958bd5ccacd9d"},{"id":"PCFA-07","path":"requirements/pcfa07-codex-implementation-backlog-reconciliation.json","role":"codex_implementation_backlog_reconciliation","sha256":"a0c30153516cc0a10ff50a7b30df811058557280ac205e6e1f78b88dcecc5c05"},{"id":"IMP-BACKLOG","path":"docs/11-BUILD-BACKLOG.md","role":"implementation_phase_and_task_namespace","sha256":"3d650537a0255bdd535f967c3086d12461ab40fcc20cf6dff9ab7de2afcec346"}],"boundaries":{"autonomous_merge_authorized":false,"codex_start_authorized":false,"external_actions_authorized":false,"founder_accountability_preserved":true,"hermes_activation_authorized":false,"merge_authorized":false,"oauth_authorized":false,"paid_services_authorized":false,"phase0_implementation_authorized":false,"phase0_merge_authorized":false,"phase1_authorized":false,"production_deployment_authorized":false,"real_client_data_enabled":false,"runtime_activation_authorized":false},"branch_cleanup_plan":{"codex_phase0_branch_must_be_absent_before_cleanup_completion":true,"delete_after_dependency_order_integration":["agent/phase2-first-agent-system","ci/phase1-contract-validation-20260804","deliverable/phase4-semantic-model","diagnostic/ws6-actions-runner","diagnostic/ws6-public-actions-runner","fix/phase1-policy-typing","fix/phase1-policy-typing-2","fix/ws66-ws67-workflow-stability","fix/ws67-evidence-manifest-completion","fixtures/phase5-additional-engagements","fixtures/phase5-engagement-suite","fixtures/phase5-strategy-cost","governance/pcr01-canonical-release","governance/pcr02-test-identity","governance/pcr03-repository-hygiene","governance/pcr04-codex-handoff","governance/pcr05-runtime-adapters","governance/pcr06-hermes-adoption","governance/pcr06-hermes-compatibility","governance/pcr07-northstar-integration","governance/pcr08-initial-operating-controls","governance/pcr09-first-codex-issue","governance/pcr09-first-codex-issue-clean","governance/pcr10-integration-reconciliation","governance/pcr10-pre-codex-readiness","governance/workstream4-cleanup-repair","governance/workstream4-hosted-controls-readiness","governance/workstream5-codex-phase0-launch-control","governance/workstream6-baseline-lock","governance/workstream6-canonical-authority-registry","governance/workstream6-current-status-documents","governance/workstream6-final-launch-control","governance/workstream6-handoff-reconciliation","governance/workstream6-phase-namespace-normalization","governance/workstream6-required-workflow-identity","governance/workstream6-required-workflow-identity-temp","governance/workstream6-required-workflow-identity-tree-test","governance/workstream6-required-workflow-identity-tree-test2","governance/ws66-required-workflow-identity-ci-open","governance/ws66-required-workflow-identity-final","governance/ws66-required-workflow-identity-retry","governance/ws67-configuration-contradictions","governance/ws67-configuration-contradictions-ci","governance/ws68-issue-backlog-normalization","governance/ws69-implementation-obligation-map","governance/ws610-developer-experience-specification","governance/ws611-founder-experience-specification","governance/ws612-deliverable-quality-implementation-specification","governance/ws613-operational-quality-specification","governance/ws614-cross-authority-consistency-gate","governance/ws615-final-workflow","governance/ws616-final-authority-reconciliation","governance/ws616-permanent-release-record","knowledge/phase6-ingestion-intelligence","oracle/phase3-ai-audit","pcfa/01-repair-launch-control-path","pcfa/02-current-operational-state","pcfa/03-repository-visibility-licence-posture","pcfa/04-product-scope-implementation-addendum","pcfa/05-minimum-valuable-consulting-loop","pcfa/06-hermes-bounded-adoption-refresh","pcfa/07-codex-implementation-backlog-reconciliation","release/ws616-permanent-release-record","security/phase7-regionalisation","pcfa/08-final-pre-codex-cross-authority-acceptance"],"expected_cleanup_branch_count_after_pcfa08_integration":65,"final_live_branch_inventory_must_equal":["main"],"observed_non_main_branch_count_before_pcfa08_branch":64,"observed_repository_branch_count_before_pcfa08_branch":65,"pcfa08_branch_added_after_observation":true,"policy":"exact_allowlist_only","require_final_sha_for_every_deleted_branch":true,"require_merged_ancestry_or_explicit_obsolete_classification":true,"retain_branches":["main"],"unexpected_branch_requires_explicit_reconciliation":true,"wildcards_prohibited":true},"canonical_branch":"main","cross_authority_invariants":[{"accepted":true,"id":"XAUTH-01","statement":"Historical WS/PCR package readiness is retained evidence and never drives current launch readiness."},{"accepted":true,"id":"XAUTH-02","statement":"repository/current-operational-state.json is the sole live machine readiness projection."},{"accepted":true,"id":"XAUTH-03","statement":"The WS6 permanent release parent and record commit are historical ancestors, not current launch-SHA equality targets."},{"accepted":true,"id":"XAUTH-04","statement":"Current repository posture requires private/internal development with no public licence grant."},{"accepted":true,"id":"XAUTH-05","statement":"PCFA-04 product scope remains planned_not_implemented until its bound IMP tasks execute."},{"accepted":true,"id":"XAUTH-06","statement":"PCFA-05 MVCL remains planned_not_implemented and Founder interrupt controls remain mandatory."},{"accepted":true,"id":"XAUTH-07","statement":"PCFA-06 Hermes capabilities remain bounded, suggestion-only where specified, and not activated."},{"accepted":true,"id":"XAUTH-08","statement":"PCFA-07 covers exactly 93 obligations with 93 planned tests and zero IMP-P0 widening."},{"accepted":true,"id":"XAUTH-09","statement":"The Codex launch target is exactly P0.1-P0.4 on codex/phase-0-foundation with a draft PR."},{"accepted":true,"id":"XAUTH-10","statement":"No implementation may begin before a valid local single-use permit binds the exact approved current main SHA."},{"accepted":true,"id":"XAUTH-11","statement":"Live Issue #1 and Issue #19 bodies must match current repository bodies at permit time."},{"accepted":true,"id":"XAUTH-12","statement":"Repository visibility, hosted controls, branch cleanup and clean macOS evidence are manual launch gates."},{"accepted":true,"id":"XAUTH-13","statement":"Historical branch cleanup is exact-name only and every deleted ref requires its final SHA to be retained."},{"accepted":true,"id":"XAUTH-14","statement":"The live GitHub branch inventory must contain only main immediately before Codex branch creation."},{"accepted":true,"id":"XAUTH-15","statement":"Founder authorization binds one exact current main SHA and exactly P0.1-P0.4; merge and P1 remain unauthorized."},{"accepted":true,"id":"XAUTH-16","statement":"The Codex branch and any Codex Phase 0 PR must be absent before permit issuance."},{"accepted":true,"id":"XAUTH-17","statement":"Synthetic data only, no runtime/Hermes activation, no real client data, no paid services, no OAuth, no external actions and no production."},{"accepted":true,"id":"XAUTH-18","statement":"Any current-authority or launch-evidence drift invalidates prior launch evidence and requires re-acceptance."}],"generated_from":"configs/pcfa08-final-pre-codex-cross-authority-acceptance.yaml","launch_target":{"implementation_may_start_only_after_valid_permit":true,"permitted_phase":"Codex Phase 0 only","permitted_tasks":["P0.1","P0.2","P0.3","P0.4"],"required_branch":"codex/phase-0-foundation","required_pull_request_state":"draft","required_status_check":"Validate final pre-Codex canonical handoff and complete release"},"manual_launch_gates":[{"id":"repository_visibility_private_verified","required_value":true,"status":"pending_manual_evidence"},{"id":"github_hosted_controls_verified","required_value":true,"status":"pending_manual_evidence"},{"id":"historical_branch_cleanup_complete","required_value":true,"status":"pending_manual_evidence"},{"id":"clean_macos_environment_verified","required_value":true,"status":"pending_manual_evidence"},{"id":"live_issue_bodies_synchronized","required_value":true,"status":"pending_integration_then_sync"},{"id":"explicit_founder_phase0_approval_received","required_value":true,"status":"pending_manual_evidence"},{"id":"approved_main_sha_bound","required_value":true,"status":"pending_manual_evidence"},{"id":"launch_permit_issued","required_value":true,"status":"pending_manual_evidence"}],"next_actions_after_integration":["synchronize_live_issue_1_and_19_bodies","make_repository_private_and_capture_evidence","verify_required_github_hosted_controls","execute_exact_allowlist_branch_cleanup_with_fi